{
  "$schema": "../schema/parchete-regiuni.schema.json",
  "id": "parchete-regiuni",
  "title": "Parchetele pe trei niveluri: 42 județene, 8 regionale, unul național",
  "publisher": "Consiliul Superior al Magistraturii",
  "period": "2025",
  "variantOfPaper": true,
  "provenance": {
    "source": "csm-starea-justitiei-2025",
    "locator": "Anexa activității parchetelor de pe lângă curţile de apel, p. 172-174",
    "confidence": "derived",
    "note": "Volumele celor 15 parchete de pe lângă curțile de apel sunt citate din anexă. Gruparea lor pe cele opt regiuni de dezvoltare urmează varianta de curți de apel din acest depozit și nu este propusă de lucrare."
  },
  "summary": {
    "officesBefore": 15,
    "officesAfter": 8,
    "absorbed": 7,
    "totalVolume": 14739,
    "totalProsecutors": 200,
    "nationalPerProsecutor": 73.7,
    "spreadBefore": {
      "min": 41.2,
      "max": 191.5,
      "median": 74.5,
      "maxOverMin": 4.65,
      "p90OverP10": 3.85
    },
    "spreadAfter": {
      "min": 41.2,
      "max": 138.0,
      "median": 68.5,
      "maxOverMin": 3.35,
      "p90OverP10": 3.58
    },
    "heaviestToday": "GALAŢI",
    "heaviestTodayPerProsecutor": 191.5,
    "lightestToday": "BUCUREŞTI",
    "lightestTodayPerProsecutor": 41.2,
    "biggestToday": "BUCUREŞTI",
    "biggestTodayVolume": 1895,
    "biggestTodayPerProsecutor": 41.2,
    "loadRunsBackwards": true,
    "biggestTodayInvestigationLoad": 72.88,
    "heaviestTodayInvestigationLoad": 306.4,
    "inversionSurvivesInvestigationMeasure": true,
    "structure": {
      "todayLower": 219,
      "todayAppellate": 15,
      "proposedCounty": 42,
      "proposedRegional": 8,
      "todayTotal": 235,
      "proposedTotal": 51
    }
  },
  "regions": [
    {
      "region": "București-Ilfov",
      "seat": "BUCUREŞTI",
      "seatCounty": "B",
      "counties": [
        "B",
        "IF"
      ],
      "officesBefore": 1,
      "absorbs": [],
      "volume": 1895,
      "prosecutors": 46,
      "perProsecutor": 41.2
    },
    {
      "region": "Centru",
      "seat": "ALBA IULIA",
      "seatCounty": "AB",
      "counties": [
        "AB",
        "BV",
        "CV",
        "HR",
        "MS",
        "SB"
      ],
      "officesBefore": 3,
      "absorbs": [
        "BRAŞOV",
        "TÂRGU-MUREŞ"
      ],
      "volume": 2644,
      "prosecutors": 26,
      "perProsecutor": 101.7
    },
    {
      "region": "Nord-Est",
      "seat": "IAŞI",
      "seatCounty": "IS",
      "counties": [
        "BC",
        "BT",
        "IS",
        "NT",
        "SV",
        "VS"
      ],
      "officesBefore": 3,
      "absorbs": [
        "BACĂU",
        "SUCEAVA"
      ],
      "volume": 2724,
      "prosecutors": 33,
      "perProsecutor": 82.5
    },
    {
      "region": "Nord-Vest",
      "seat": "CLUJ",
      "seatCounty": "CJ",
      "counties": [
        "BH",
        "BN",
        "CJ",
        "MM",
        "SJ",
        "SM"
      ],
      "officesBefore": 2,
      "absorbs": [
        "ORADEA"
      ],
      "volume": 1439,
      "prosecutors": 25,
      "perProsecutor": 57.6
    },
    {
      "region": "Sud",
      "seat": "PITEŞTI",
      "seatCounty": "AG",
      "counties": [
        "AG",
        "CL",
        "DB",
        "GR",
        "IL",
        "PH",
        "TR"
      ],
      "officesBefore": 2,
      "absorbs": [
        "PLOIEŞTI"
      ],
      "volume": 1486,
      "prosecutors": 23,
      "perProsecutor": 64.6
    },
    {
      "region": "Sud-Est",
      "seat": "CONSTANŢA",
      "seatCounty": "CT",
      "counties": [
        "BR",
        "BZ",
        "CT",
        "GL",
        "TL",
        "VN"
      ],
      "officesBefore": 2,
      "absorbs": [
        "GALAŢI"
      ],
      "volume": 2760,
      "prosecutors": 20,
      "perProsecutor": 138.0
    },
    {
      "region": "Sud-Vest",
      "seat": "CRAIOVA",
      "seatCounty": "DJ",
      "counties": [
        "DJ",
        "GJ",
        "MH",
        "OT",
        "VL"
      ],
      "officesBefore": 1,
      "absorbs": [],
      "volume": 1014,
      "prosecutors": 14,
      "perProsecutor": 72.4
    },
    {
      "region": "Vest",
      "seat": "TIMIŞOARA",
      "seatCounty": "TM",
      "counties": [
        "AR",
        "CS",
        "HD",
        "TM"
      ],
      "officesBefore": 1,
      "absorbs": [],
      "volume": 777,
      "prosecutors": 13,
      "perProsecutor": 59.8
    }
  ],
  "offices": [
    {
      "office": "ALBA IULIA",
      "volume": 1124,
      "perProsecutor": 124.89,
      "perSchema": 80.29,
      "perProsecutorInvestigation": 140.5,
      "prosecutors": 9,
      "region": "Centru"
    },
    {
      "office": "BACĂU",
      "volume": 614,
      "perProsecutor": 47.23,
      "perSchema": 43.86,
      "perProsecutorInvestigation": 102.33,
      "prosecutors": 13,
      "region": "Nord-Est"
    },
    {
      "office": "BRAŞOV",
      "volume": 685,
      "perProsecutor": 62.27,
      "perSchema": 48.93,
      "perProsecutorInvestigation": 114.17,
      "prosecutors": 11,
      "region": "Centru"
    },
    {
      "office": "BUCUREŞTI",
      "volume": 1895,
      "perProsecutor": 41.2,
      "perSchema": 37.9,
      "perProsecutorInvestigation": 72.88,
      "prosecutors": 46,
      "region": "București-Ilfov"
    },
    {
      "office": "CLUJ",
      "volume": 545,
      "perProsecutor": 41.92,
      "perSchema": 36.33,
      "perProsecutorInvestigation": 109.0,
      "prosecutors": 13,
      "region": "Nord-Vest"
    },
    {
      "office": "CONSTANŢA",
      "volume": 1228,
      "perProsecutor": 102.33,
      "perSchema": 76.75,
      "perProsecutorInvestigation": 175.43,
      "prosecutors": 12,
      "region": "Sud-Est"
    },
    {
      "office": "CRAIOVA",
      "volume": 1014,
      "perProsecutor": 72.43,
      "perSchema": 59.65,
      "perProsecutorInvestigation": 169.0,
      "prosecutors": 14,
      "region": "Sud-Vest"
    },
    {
      "office": "GALAŢI",
      "volume": 1532,
      "perProsecutor": 191.5,
      "perSchema": 102.13,
      "perProsecutorInvestigation": 306.4,
      "prosecutors": 8,
      "region": "Sud-Est"
    },
    {
      "office": "IAŞI",
      "volume": 942,
      "perProsecutor": 85.64,
      "perSchema": 72.46,
      "perProsecutorInvestigation": 134.57,
      "prosecutors": 11,
      "region": "Nord-Est"
    },
    {
      "office": "ORADEA",
      "volume": 894,
      "perProsecutor": 74.5,
      "perSchema": 68.77,
      "perProsecutorInvestigation": 178.8,
      "prosecutors": 12,
      "region": "Nord-Vest"
    },
    {
      "office": "PITEŞTI",
      "volume": 983,
      "perProsecutor": 81.92,
      "perSchema": 75.62,
      "perProsecutorInvestigation": 140.43,
      "prosecutors": 12,
      "region": "Sud"
    },
    {
      "office": "PLOIEŞTI",
      "volume": 503,
      "perProsecutor": 45.73,
      "perSchema": 33.53,
      "perProsecutorInvestigation": 100.6,
      "prosecutors": 11,
      "region": "Sud"
    },
    {
      "office": "SUCEAVA",
      "volume": 1168,
      "perProsecutor": 129.78,
      "perSchema": 97.33,
      "perProsecutorInvestigation": 292.0,
      "prosecutors": 9,
      "region": "Nord-Est"
    },
    {
      "office": "TÂRGU-MUREŞ",
      "volume": 835,
      "perProsecutor": 139.17,
      "perSchema": 64.23,
      "perProsecutorInvestigation": 208.75,
      "prosecutors": 6,
      "region": "Centru"
    },
    {
      "office": "TIMIŞOARA",
      "volume": 777,
      "perProsecutor": 59.77,
      "perSchema": 51.8,
      "perProsecutorInvestigation": 129.5,
      "prosecutors": 13,
      "region": "Vest"
    }
  ],
  "limitations": [
    {
      "id": "regiunile-nu-sunt-in-lucrare",
      "text": "Lucrarea păstrează 15 parchete de pe lângă curțile de apel și nu propune regiuni pentru ele. Gruparea de aici este o variantă a acestui depozit, construită ca oglindă a variantei de curți de apel — parchetele sunt organizate în oglinda instanțelor, iar a regionaliza instanțele fără parchete ar rupe tocmai simetria pe care stă sistemul.",
      "severity": "blocking",
      "affects": [
        "regions",
        "summary"
      ]
    },
    {
      "id": "comasarea-nu-muta-procurori",
      "text": "Comasarea schimbă unde sunt granițele, nu unde sunt oamenii. Nimic din raport nu spune cum s-ar încadra un parchet regional, deci încărcătura de după e volumul comasat împărțit la procurorii care există azi în acele sedii. Dacă schema s-ar rescrie odată cu harta, cifrele ar arăta altfel.",
      "severity": "material",
      "affects": [
        "regions"
      ]
    },
    {
      "id": "posturile-sunt-deduse-si-aici",
      "text": "Anexa nu tipărește numărul de procurori, ci încărcătura pe procuror, așa că numărul e dedus împărțind volumul la ea — chiar definiția indicatorului. Rotunjirea la procuror întreg introduce o eroare mică în încărcăturile regionale.",
      "severity": "material",
      "affects": [
        "regions",
        "offices"
      ]
    },
    {
      "id": "distanta-creste-pentru-justitiabili",
      "text": "Aceleași distanțe care apar la varianta de curți de apel se aplică și aici: comasarea a 15 sedii în 8 duce media pe județ până la sediul de regiune de la 56 la 124 de km, iar 24 de județe merg mai departe decât azi. Pentru parchete contează mai puțin decât pentru instanțe — cetățeanul se duce rar la parchetul de apel — dar nu contează deloc.",
      "severity": "material",
      "affects": [
        "regions"
      ]
    }
  ]
}
